songName,artistName,lyrics
"If He Can Fight Like He Can Love, Good Night Germany",['Most Happy Fellows'],"VERSE 1
Little Mary’s beau, said “I’ve got to go,
I must fight for Uncle Sam”
Standing in the crowd
Mary called aloud “Fare thee well my lovin’ man”
All the girls said “Ain’t he nice and tall,”
Mary answered “yes, and that’s not all.”

CHORUS 1
“If he can fight like he can love,
Oh, what a soldier boy he’ll be!
If he’s just half as good in a trench
As he was in the park on a bench.
Then ev’ry Hun, had better run
And find a great big linden tree,
I know he’ll be a Hero ”over there”
‘Cause he’s a bear in any Morris chair
And if he fights like he can love
Why, then it’s good night Germany!”
“If he can y!”

VERSE 2
Ev’ry single day, all the papers say,
Mary’s beau is oh, so brave
With his little gun, chasing ev’ry Hun
He has taught them to behave\
Little Mary proudly shakes her head,
And says “Do you remember when I said?”

CHORUS 2
“If he can fight like he can love,
Oh, what a soldier boy he’ll be!
If he’s just half as good in a trench
As he was in the park on a bench.
Then ev’ry Hun, had better run
And find a great big linden tree,
I never saw him in a real good scrap
But you’re goner when you’re in his lap
And if he fights like he can love
Why, then it’s good night Germany!”
“If he can y!”"
Love's Garden of Roses (Recorded 1918),['John McCormack'],"(Chorus) The sun and the rain fell from up above 
And landed on the earth below
In my garden of love

Now there’s a rose for the way my spirits rose when we met
A forget-me-not to remind me to remember not to forget
A pine tree for the way I pined over you
And an ash for the day I ashed you to be true

(Chorus) And the sun.

Now there’s a palm tree that we planted when we had our first date
A turnip for the way you always used to turnip late
Your mother and your cousin, Chris, they often used to come
So, in their honour, I have raised a nice chris-an’-the-mum

(Chorus) And the sun.

Now there’s a beetroot for the day you said that you’d beetroot to me
A sweet pea for the sweet way you always smiled at me
But you had friends who needed you 
There was Ferdy, there was Liza
So, just for them, I put down a load of ferdy-liza

(Chorus) And the sun.

But Gus the gardener’s left now and you went with him, too
The fungus there reminds me of the fun Gus is having with you
Now the rockery’s a mockery, with weeds it’s overgrown
The fuchsia’s gone, I couldn’t face the fuchsia all alone

And my tears fell like raindrops from the sky above
And poisoned all the flowers in my garden of love"
They Were All Out of Step But Jim,['Chiefs of Staff'],"[Verse 1]
Jimmy's mother went to see her son
Marching along on parade
In his uniform and with his gun
What a lovely picture he made
She came home that evening
Filled up with delight
And to all the neighbors
She would yell with all her might

[Chorus]
""Did you see my little Jimmy marching
With the soldiers up the avenue?
There was Jimmy just as stiff as starch
Just like his father on the seventeenth o' March
Did you notice all the lovely ladies
Casting their eyes at him?
Away he went
To live in a tent
Over in France with his regiment
Were you there, and tell me, did you notice?
They were all out of step but Jim""

[Verse 2]
That night little Jimmy's father stood
Buying the drinks for the crowd
You could tell that he was feeling good
He was talking terribly loud
Twenty times he treated
My, but he was dry
When his glass was empty
He would treat again and cry

[Chorus]
""Did you see me little Jimmy marching
With the soldiers up the avenue?
There was Jimmy just as stiff as starch
Like his father on the seventeenth o' March
Did you notice all the lovely ladies
A-casting their eyes at him?
Sure it made me glad
To gaze at the lad
And Lord help the Kaiser if he's like his dad
Were you there, oh you were, well did you notice?
They were all out of step but Jim"""
The Daughter Of Rosie O'Grady,['Ian Whitcomb'],"Just down around the corner
of the street where I reside,
There lives the cutest little girl
that I have ever spied;
Her name is Rose O'Grady and,
I don't mind telling you,
That she's the sweetest little Rose
the garden ever grew.

Sweet Rosie O'Grady,
My dear little Rose,
She's my steady lady,
Most ev'ryone knows.
And, when we are married,
How happy we'll be;
I love sweet Rosie O'Grady,
And Rosie O'Grady loves me.

I never shall forget the day
she promised to be mine,
As we sat telling love tales
in the golden summer time.
'Twas on her finger that I placed
a small engagement ring,
While in the trees, the little birds
this song they seemed to sing!

Sweet Rosie O'Grady,
My dear little Rose,
She's my steady lady,
Most ev'ryone knows.
And, when we are married,
How happy we'll be;
I love sweet Rosie O'Grady,
And Rosie O'Grady loves me."
My Buddy,['Henry Burr'],"Nights are long since you went away,
I think about you all through the day,
My buddy, my buddy, no buddy quite so true.
Miss your voice, the touch of your hand,
Just long to know that you understand,
My buddy, my buddy, your buddy misses you
Miss your voice, the touch of your hand,
Just long to know that you understand,
My buddy, my buddy, your buddy misses you"
Hindustan,"[""Joseph C. Smith's Orchestra""]","Camel trappings jingle, harp strings tingle
With a sweet voice mingle, underneath the stars
Singing, memories are bringing
Temple bells are ringing, calling me afar


Hindustan, my Hindustan, where we stopped to rest our tired caravan
Hindustan, my Hindustan, where the painted peacock proudly spreads his fan
Hindustan, my Hindustan, where the purple sunbird flashed across the sand
Hindustan, my Hindustan, where I met her and the world began


Shades of night are falling, nightingales are calling
Every heart enthralling, underneath the stars
Sighing, like the night wind dying
Soft my heart is crying for my love afar


Hindustan, my Hindustan, where we stopped to rest our tired caravan
Hindustan, my Hindustan, where the painted peacock proudly spreads his fan
Hindustan, my Hindustan, where the purple sunbird flashed across the sand
Hindustan, my Hindustan, where I met her and the world began"
God Be With Our Boys To-Night,"['Jon English, Rob Carriker, Marlborough Singers & Marlborough Chamber Players']","Brave eyes that looked so tenderly,
Where are you now today?
Sad was our heart at break of dawn,
After you went away.
Loud sang the lark o’er fields of gold,
High in the heavens above;
Winter alone within our hearts,
Calling for you we love.

Chorus:
O waiting heart, I dare not tell
How dark and long the lane!
Only I pray that God will bring
Our dear ones back again
Safe to a home of peace and light
Across the furthest sea;
May God be with our boys tonight,
Wherever they may be.

Brave ones who answered your country’s call,
How could we let you go
Out of the sunshine of our souls,
Save that we love you so?
There is a place within our hearts
No one on earth may fill;
Someday at last you’ll come back to us,
Watching and longing still!"
Everybody's Crazy 'Bout The Doggone Blues,['Mark Murphy'],"Lyrics:

1. Blues ain’t nothin’ but the
Easy goin’ heart disease
Brother stop your moanin’
Blues can’t make you warmer
If you’re bound to freeze
Sister stop your groanin’
Why don’t you rise and shine
Take dem blues right off your mind
‘Cause the blues ain’t nothin’
But the easy goin’ heart disease
That’s all! Lawd!

Chorus:
Everybody’s crazy ’bout the doggone blues
But I’m happy, (whew) yes happy, (whew)
Everybody’s crazy, but if I must choose
No doggone blues for mine
I gets aplenty to eat, I never worry
Shoes on my feet, don’t have to hurry
I’m not afraid, my rent is paid
And I can sleep at ninety-four in the shade
Everybody’s singing lotta bad old news
But I’m happy, (whew) yes happy, (whew)
Life’s too doggone short to weep and whine
Dem home sickness blues, Lawd! take ’em away
Every body’s crazy ’bout the doggone blues
But I’m happy all of the time, (whew)

2. You all know how Mister Jonah
Got into that whale
Fell into the ocean
There’s one man that should have
Sung the blues but failed
Never had the notion
Old Jonah knew dem whales
‘Stead of blues he ragged the scales
Then the whale got gay and let
Old Jonah slip right out of jail
No lie! Lawd!"
Where the Morning Glories Grow,['Dear Nora'],"I remember, I remember
The place where I was born
Where the morning glories twine
Around the door at early morn

I've forgotten, I've forgotten
How long I've been away
But I'd like to wander back again
Down the lane to yesterday

I want to wake up in the morning
Where the morning glories grow
Where the sun comes peeping in
Where I'm sleeping and the songbirds say, ""Hello""

I long to wander in the wild wood
Where the rippling waters flow
And go drifting back to childhood
Where the morning glories grow

I remember, I remember
The schoolhouse on the hill
And I wonder if the tiny folks
Are climbing up there still

I can picture, I can picture
The dear old swimming pool
And the happy days that I spent there
When I should have been in school

I want to wake up in the morning
Where the morning glories grow
Where the sun comes peeping in
Where I'm sleeping and the songbirds say, ""Hello""

I long to wander in the wild wood
Where the rippling waters flow
And go drifting back to childhood
Where the morning glories grow"
The Old Grey Mare,['Albert White And His Gaslight Orchestra'],"Oh the old grey mare
She ain't what she used to be
Ain't what she used to be
Ain't what she used to be
The old grey mare
She ain't what she used to be
Many long years ago
Many long years ago
Many long years ago
Oh the old grey mare
She ain't what she used to be
Many long years ago

Oh the old grey mare
She ain't what she used to be
Ain't what she used to be
Ain't what she used to be
The old grey mare
She ain't what she used to be
Many long years ago
Many long years ago
Many long years ago
Oh the old grey mare
She ain't what she used to be
Many long years ago"
Roses Of Picardy,['Alfie Boe'],"She is watching by the poplars
Colinette with the sea-blue eyes
She is watching and longing, and waiting
Where the long white roadway lies
And a song stirs in the silence
As the wind in the boughs above
She listens and starts and trembles
'Tis the first little song of love

Roses are shining in Picardy
In the hush of the silver dew
Roses are flowering in Picardy
But there's never a rose like you!
And the roses will die with the summertime
And our roads may be far apart
But there's one rose that dies not in Picardy
'Tis the rose that I keep in my heart

And the years fly on forever
Till the shadows veil their skies
But he loves to hold her little hands
And look into her sea-blue eyes
And she sees the road by the poplars
Where they met in the bygone years
For the first little song of the roses
Is the last little song she hears:

Roses are shining in Picardy
In the hush of the silver dew
Roses are flowering in Picardy
But there's never a rose like you!
And the roses will die with the summertime
And our roads may be far apart
But there's one rose that dies not in Picardy
'Tis the rose that I keep in my heart"
K-K-K-Katy,['Billy Murray'],"Jimmy was a soldier brave and bold
Katy was a maid with hair of gold
Like an act of fate, Kate was standing at the gate
Watching all the boys file on parade
Kate smiled with a twinkle in her eye
Jim said ""M-m-meet you by-and-by!""
That same night at eight
Jim was at the garden gate
Stuttering this song to K-K-K-Kate

K-K-K-Katy, beautiful Katy
You're the only g-g-g-girl that I adore
When the m-m-m-moon shines
Over the cow shed
I'll be waiting at the k-k-k-kitchen door

K-K-K-Katy, beautiful Katy
You're the only g-g-g-girl that I adore
When the m-m-m-moon shines
Over the cow shed
I'll be waiting at the k-k-k-kitchen door

""No one ever looked so nice and neat!""
""No one could be just as cute and sweet!""
That's what Jimmy thought
When the wedding ring he bought
Now he's off to France the foe to meet
Jimmy thought he'd like to take a chance
See if he could make the Kaiser dance
Stepping to a tune
All about the silv'ry moon
This is what they hear in far off France

K-K-K-Katy, beautiful Katy
You're the only g-g-g-girl that I adore
When the m-m-m-moon shines
Over the cow shed
I'll be waiting at the k-k-k-kitchen door

K-K-K-Katy, beautiful Katy
You're the only g-g-g-girl that I adore
When the m-m-m-moon shines
Over the cow shed
I'll be waiting at the k-k-k-kitchen door"
Just a Girl That Men Forget (Victor 19131) [Recorded 1923],['Henry Burr'],"1. Dear little girl, they call you a Vamp
A flapper with up-to-date ways
You may shine brightly but just like a lamp
You’ll burn out one of these days
Then your old fashioned sister will com into view
With a huband and kiddies, but what abou you?

Chorus:
You’re the kind of a girl that men forget
Just a toy to enjoy for a while
For when men settle down
They get an old fashioned girl
With an old fashioned smile
And you’ll soon realize you’re not so wise
When the years bring you tears of regret
When they play “Here comes the bride”
You’ll stand outside
Just a girl that men forget

2. Wall flower girl, now dry all those tears
For you won’t be left all alone
Some day you’ll find yourself upon a throne
Queen of a sweet little home
And you gay little flapper, you’ll live and you’ll learn
When you’ve gone down the pathway that has no return"
When I Leave the World Behind (Recorded 1915),['Henry Burr'],"I know a millionaire
Who's burdened down with care
A load Is on his mind
He's thinking of the day
When he must pass away
And leave his world behind
I haven't any gold
To leave when I grow old
Somehow its passed by
I'm very poor but still
I leave a precious will
When i must say goodbye
I leave the sunshine to the flowers
I leave the spring time to the trees
And to the old folk I leave a memory
Of a baby upon their knees
I leave the nighttime to the dreamers
I leave the songbird to the blind
I leave the moon above to those in love
when I leave the world behind, when I leave the world behind
I leave the sunshine to the flowers
I leave the springtime to the trees
And to the old folk I leave a memory
Of a baby upon their knees
I leave the nighttime to the dreamers
I leave the songbird to the blind
I leave the moon above to those in love
When I leave the world behind
When I leave the world behind"
There's a Little Blue Star in the Window (WW1 Song) [Victor 18524] [Recorded 1918],['Henry Burr'],"There’s a Little Blue Star in the Window and it Means all the World to Me [Verse] There’s a little blue star in the window, And it means all the world to me
There’s a lad who is true To the Red, White and Blue, And he’s serving his Flag o’er the sea. But it does not reflect golden sunshine, Never gleams in the dead of night
In the brightness of day, As the night wears away, It shines with its own holy light. [Refrain] There are stars in the high heavens shining With a promise of hope in their light. There are stars in the field of Old Glory, The emblem of honor and right. But no star ever shone with more brightness, I know, Than the one for my boy o’er the sea
There’s a little blue star in the window, And it means all the world to me. [Verse] When the sun sinks to rest in the evening And the stars in the dark’ning sky Shine with soft, tender light, Till the heavens are bright, Then a glorious sight greets the eye. But the brightest of stars in the heavens Does not shine with the brilliancy As the little one there In the window--my pray'r For my laddie over the sea. [Refrain]"
Indianola,['Charlie Robison'],"My little brother was just ten years old
When we hit bad weather and hid in the hole
We could see Texas was only a mile
And oh, little brother, I remember your smile
At Indianola

My dad built a sawmill of cypreses and stone
It was here on Madena that we made our home
The year 1850 and I sent for my girl
Oh Frauline, come meet me in this brand new world
At Indianola

The war they call civil had barely begun
Me and my cousins decided we'd run
Up through Louisianan to meet up with Grant
But one hundred damn rebels shot us there in the sand
At Indianola

They said up in New York, the stock market fell
And the life they was livin' was shot all to hell
But we ain't seen nothin' no different than dust
Sept the wheels on the wagon all covered with rust
At Indianola

And that scrape with old Hitler was over and done
And I wondered if I could kill kin with my gun
But we sat there in Paris in a little caf√©
And as they toasted Truman, I drifted away
To Indianola

But it's fifty years later and nobody cares
About some old city that ain't even there
Well, my sons moved to Houston
And they work in the Gulf
With seven days on and seven days off

Well I work for the doctor that bought our old ranch
From first quality federal the foreclosures branch
And he calls me hillbilly and he laughs at my hair
But the cancer will get him if anything's fair

And I'll take his ashes and throw from my boat
As they crossed that ocean I'm going to float
To find me another Indianola
Indianola
Indianola"
When Alexander Takes His Ragtime Band to France,['Marion Harris'],"[Verse 1]
What’s that tune I hear? A ringing in my ear
Come on along, come on along, It’s a wonderful idea
It’s Alexander’s band, from down in Dixieland
He’s going “over there” to do his share

[Chorus]
When Alexander takes his ragtime band to France
He’ll capture ev’ry Hun, and take them one by one
Those ragtime tunes will put the Germans in a trance
They’ll throw their guns away, hip hip hooray!
And start right in to dance
They’ll get so excited they’ll come over the top
Two step back to Berlin with a skip and a hop
Old Hindenburg will know he has no chance
When Alexander takes his ragtime band to France

[Verse 2]
There’s no time to lose, they’ll put on dancing shoes
They’ll glide away, and slide away
When they hear those weary blues
The goose step’s on the wane, the two step’s in again
Like they advanced at first, they’ve just reversed

[Chorus]
When Alexander takes his ragtime band to France
He’ll capture ev’ry Hun, and take them one by one
Those ragtime tunes will put the Germans in a trance
They’ll throw their guns away, hip hip hooray!
And start right in to dance
They’ll get so excited they’ll come over the top
Two step back to Berlin with a skip and a hop
Old Hindenburg will know he has no chance
When Alexander takes his ragtime band to France"
Let the Rest of the World Go By,"['Elizabeth Spencer', 'Charles Hart']","With someone like you, a pal good and true
I'd like to leave it all behind and go and find
A place that's known to God alone
Just a spot we could call our own
We'll find perfect peace where joys never cease
Somewhere beneath the stary skies
We'll build a sweet little nest somewhere in the west
And let the rest of the world go by
With someone like you, a pal good and true
I'd like to leave it all behind and go and find
A place that's known to God alone
Just a spot can call our own
And we'll find perfect peace where joys never cease
Out there beneath the stary skies
We'll build a sweet little nest somewhere in the west
And let the rest of the world go by
And let the rest of the world go by"
My Baby Boy,['theAngelcy'],"My baby boy is in the army of disbelief.
My baby boy is in the army of midsummer grief.
Tossing and turning in his bed,
Guessing his own end,
Tossing and turning in his bed,
My baby boy's already dead.
We are a natural disaster,
Shake, mama, shake your head.
We are a natural disaster,
Lost all hope to ever understand
The powers in command here.
Pray for my baby boy.
No bombs to drop and kill them all,
No money paid to charge our souls,
No mind control, no wall,
Just summer, winter, spring and fall.
We are a natural disaster,
Shake, mama, shake your head.
We are a natural disaster,
Lost all hope to ever understand
The powers in command here.
Pray for my baby boy."
Liberty Bell,['The Peerless Quartet'],"No brainwaves or activity
While the craft is in the air
It's getting dark, it's getting light
We are sitting in a chair
We have fastened every belt
We cannot float out of our seats
It's so enormously frightening
When our tail reaches superheat
Another timezone
A change of season
It is turning dark again
We're getting ready for yet
Another orbit around our planet
It is time for the galactic cruise
To come to an end
One last view on the world
And the time we have spend
We are sitting in a chair
Sitting in a chair
Sitting in a chair"
"There's a Long, Long Trail",['Sons of the Pioneers'],"Nights are growing lonely,
Days are very long;
I'm a-growing weary
Only list'ning for your song.
Old remembrances are thronging
Thro' my memory,
Thronging till it seems
The world is full of dreams,
Just to call you back to me.

There's a long, long trail a-winding
Into the land of my dreams,
Where nightingales are singing
And a white moon beams:
There's a long, long night of waiting
Until my dreams all come true;
Till the day when I'll be going down
That long, long trail with you.

All night long I hear you calling,
Calling sweet and low;
Seem to hear your footsteps falling
Ev'ry where I go.
Tho' the road between us stretches
Many a weary mile,
Somehow I forget
That you're not with me yet
When I think I see you smile.

There's a long, long trail a-winding
Into the land of my dreams,
Where nightingales are singing
And a white moon beams:
There's a long, long night of waiting
Until my dreams all come true;
Till the day when I'll be going down
That long, long trail with you."
"Pack Up Your Troubles in Your Old Kit-Bag, and Smile, Smile, Smile",['Nathan Lay'],"Pack up your troubles in your old kit-bag
And smile, smile, smile
While you've a lucifer to light your fag
Smile, boys, that's the style!
What's the use of worrying?
It never was worthwhile
So pack up your troubles in your old kit-bag
And smile, smile, smile

Pack up your troubles in your old kit-bag
And smile, smile, smile
While you've a lucifer to light your fag
Smile, boys, that's the style!
What's the use of worrying?
It never was worthwhile
So pack up your troubles in your old kit-bag
And smile, smile, smile"
On the Road to Home Sweet Home,"['Grand Dominion Jazz Band', 'Bob Jackson', 'Gerry Green', 'Jim Armstrong', 'Bob Pelland', 'Jim Marsh', 'Mike Duffy', 'Mike McCombe']","Somewhere the stars are gleaming, somewhere the Moon shines bright
Somewhere the boys are dreaming and through the weary night
To ev'ry heart that's lonely there comes a vision fair
Just a picture of Home Sweet Home and a loved one waiting there

There's a window light a-burning for someone out there
There's a heart that's ever yearning and a head bowed down in prayer
There's a loving hand to guide him where e're he may roam
Back again to peaceful valley on the road to Home Sweet Home

Somewhere the day is breaking, somewhere the bugle calls
Somewhere a heart is aching, somewhere a teardrop falls
But there's a smile behind it, hope whispers, ""Don't you sigh""
It's a long way to Home Sweet Home, but we'll get there bye and bye

There's a window light a-burning for someone out there
There's a heart that's ever yearning and a head bowed down in prayer
There's a helping hand to guide him where e're he may roam
Back again to peaceful valley on the road to Home Sweet Home"
I'm Always Chasing Rainbows - Hazbin Hotel Version,['Sierra Nelson'],"I'm always chasing rainbows
Watching clouds drifting by
My schemes are just like all my dreams
Ending in the sky
Some fellows look and find the sunshine
I always look and find the rain
Some fellows make a winning sometime
I never even make a gain, believe me
I'm always chasing rainbows
Waiting to find a little bluebird in vain
Some fellows look and find the sunshine
But I always look and find the rain
Some fellows make a winning sometime
I never even make a gain, believe me
I'm always chasing rainbows
Waiting to find a little bluebird in vain"
Danny Boy,['The Irish Tenors'],"O Danny boy, the pipes, the pipes are calling
From glen to glen and down the mountainside
The summer's gone and all the roses dying
It's you, it's you must go and I must bide

But come ye back when summer's in the meadow
Or when the valley's hushed and white with snow
'Tis I'll be here in sunshine or in shadow
O Danny boy, O Danny boy, I love you so

And when you come and all the flowers are dying
If I am dead, as dead I well may be
You'll come and find the place where I am lying
And kneel and say an Ave there for me

And I shall hear, though soft your tread above me
And all my grave shall warmer, sweeter be
For you will bend and tell me that you love me
And I shall sleep in peace until you come to me"
Love's Old Sweet Song,['John McCormack'],"Once in the dear dead days beyond recall.
When on the world the mists began to fall,
Out of the dreams that rose in happy throng
Low to our hearts love sang an old sweet song
And in the dusk where fell the firelight gleam
Softly it wove itself into our dream
Just a song at twilight
When the lights are low,
And the flickering shadows
Softly come and go
Though the heart be weary,
Sad the day and long,
Still to us at twilight comes love's old song
Comes love's old sweet song.
Even today we hear love's song of yore
Deep in our hearts it dwells forever more
Footsteps may falter, weary grows our way
Still we can hear it at the close of day
So till the end when life's dim shadows fall
Love will be found the sweetest song of all.
Just a song at twilight
When the lights are low,
And the flickering shadows
Softly come and go
Though the heart be weary,
Sad the day and long,
Still to us at twilight comes love's old song
Comes love's old sweet song."
