songName,artistName,lyrics
Just a Baby's Prayer at Twilight,['Henry Burr'],"(Verse)
I've heard the prayers of mothers
Some of them old and gray
I've heard the prayers of others
For those who went away
Oft times a prayer will teach one
The meaning of goodbye
I've felt the pain of each one
But this one made me cry

(Pre-Chorus)
Just a baby's prayer at twilight
When lights are low
Her baby's years, are filled with tears
There's mother there at twilight
Who's proud to know
Her precious little tot
Is Dad's forget-me-not
After saying ""Goodnight, Mama""
She climbs upstairs
Quite unaware
And says her prayer

(Chorus)
""Oh, kindly tell my daddy that he must take care""
That's a baby's prayer at twilight
For her daddy, over there

(Instrumental)

(Chorus)
""Oh, kindly tell my daddy that he must take care""
That's a baby's prayer at twilight
For her daddy, over there"
Rock-A-Bye Your Baby With A Dixie Melody,['Jerry Lewis'],"Rock-a-bye your baby with a Dixie melody ‚Äì
When you croon
Croon a tune
From the heart of Dixie!

Just hang my cradle, mammy mine
Right on the Mason Dixon line
And swing it from Virginia
To Tennessee with all the love that's in ya!

Weep no more, weep no more, my lady
Sing that song again for me
So soft and low, just as though
You had me on your knee!

A million baby kisses, that I would deliver
The minute that you sing the Swanee River ‚Äì
Rock-a-bye your rock-a-bye baby with a Dixie melody!

Oh, weep no more, my lady
Sing that song again for me
So soft and low
Just as though
You had me on your knee!

A million baby kisses, that I would deliver
The minute that you sing the Swanee River ‚Äì
Rock-a-bye your rock-a-bye baby with a Dixie melody!"
I'm Always Chasing Rainbows - Single Version,['Judy Garland'],"I'm always chasing rainbows
Watching clouds drifting by
My schemes are just like all my dreams
Ending in the sky
Some fellows look and find the sunshine
I always look and find the rain
Some fellows make a winning sometime
I never even make a gain, believe me
I'm always chasing rainbows
Waiting to find a little bluebird in vain
Some fellows look and find the sunshine
But I always look and find the rain
Some fellows make a winning sometime
I never even make a gain, believe me
I'm always chasing rainbows
Waiting to find a little bluebird in vain"
Oh! How I Hate to Get Up in the Morning,['Matt Cherne'],"The other day I chanced to meet a soldier friend of mine,
he'd been in camp for sevral weeks and he was looking fine;
His muscles had developed and his cheeks were rosy red,
I asked him how he liked the life, and this is what he said:
Oh! how I hate to get up in the morning,
Oh! how Id love to remain in bed;
For the hardest blow of all, is to hear the bugler call;
you've got to get up, you've got to get up, you've got to get up this morning!
Some day I'm going to murder the bugler,
Some day they're going to find him dead;
Ill amputate his reveille, and step upon it heavily,
And spend the rest of my life in bed.
Oh! how I hate to get up in the morning,
Oh! how Id love to remain in bed;
For the hardest blow of all, is to hear the bugler call;
you've got to get up, you've got to get up, you've got to get up this morning!
Oh! boy the minute the battle is over,
Oh! boy the minute the foe is dead;
I'll put my uniform away, and move to Philadelphia,
And spend the rest of my life in bed.
A bugler in the army is the luckiest of men,
He wakes the boys at five and then goes back to bed again;
He doesn't have to blow again until the afternoon,
If evry thing goes well with me I'll be a bugler soon.
Oh! how I hate to get up in the morning,
Oh! how Id love to remain in bed;
For the hardest blow of all, is to hear the bugler call;
you've got to get up, you've got to get up, you've got to get up this morning!
Some day I'm going to murder the bugler,
Some day they're going to find him dead;
Ill amputate his reveille, and step upon it heavily,
And spend the rest of my life in bed.
Oh! how I hate to get up in the morning,
Oh! how Id love to remain in bed;
For the hardest blow of all, is to hear the bugler call;
you've got to get up, you've got to get up, you've got to get up this morning!
Oh! boy the minute the battle is over,
Oh! boy the minute the foe is dead;
I'll put my uniform away, and move to Philadelphia,
And spend the rest of my life in bed."
"Hail, Hail the Gang's All Here",['Frank 88 Malone'],"Well the devil's nipping at your heels and this time it's for real
A lonely hunger starts to gnaw as you wish away the pain
Of another desperate dead end day forever filled with sadness
To forget about the pain you take your bottle, drink your grave

[Chorus]
Singing Hail, Hail, the Gangs All Here
Leave your worries at the door boy, they're not going anywhere
Hail, hail the gang's all here
When the going gets tough, I know my friends will still be there
Well you're walking down the road and the wind is in your face
You're down and out and the unemployment line's a mile long
The money in your pocket may not get you through the day
But cheer up son I know a place where mugs like us belong

[Chorus]
Pick your heart up off the ground though I'm sure it weights a ton
You're no better or no worse than any mothers son
Though you're up against all odds and you're backed against the wall
You recall the cheer, ""The Gang's All Here"" and shout!"
I'm All Bound 'Round with the Mason-Dixon Line,['Rosy McHargue & Friends'],"My daddy courted my Mammy, away down South; 
they married in Alabammy, away down South; 
and when I came into this world, old Dixie gave me birth, 
that's why I claim that Dixie is the finest place on earth. 
They brought me up in sunny Caroline, 
and they just planted Dixie in the heart of mine.

Last night I lay awake thinking of Dixie land; 
thinking of Abraham Lincoln, and Dixie land; 
he surely loved the stars and stripes, the Southern and the North, 
and his poor heart was broken when the loyal sons marched forth. 
Why no one loved old Dixie more than he, 
excepting that it might have been poor little me.

I'm all abound round with the Mason Dixon Line; 
it's pulling me, back where I used to be; 
when I was younger I knew every lane. 
Now I hunger to be once again; 
back where the robin keeps throbbing pretty melodies; 
and when I'm all bound round with a pair of loving arms, 
Oh! mother mine! I'll know I'm in Caroline; 
I've read a lot about Heaven, but give me Dixie all the time; 
for I've found that I'm bound, bound all around, with the Mason Dixon Line.
My daddy courted my Mammy, away down South; 
they married in Alabammy, away down South; 
and when I came into this world, old Dixie gave me birth, 
that's why I claim that Dixie is the finest place on earth. 
They brought me up in sunny Caroline, 
and they just planted Dixie in the heart of mine.

Last night I lay awake thinking of Dixie land; 
thinking of Abraham Lincoln, and Dixie land; 
he surely loved the stars and stripes, the Southern and the North, 
and his poor heart was broken when the loyal sons marched forth. 
Why no one loved old Dixie more than he, 
excepting that it might have been poor little me.

I'm all abound round with the Mason Dixon Line; 
it's pulling me, back where I used to be; 
when I was younger I knew every lane. 
Now I hunger to be once again; 
back where the robin keeps throbbing pretty melodies; 
and when I'm all bound round with a pair of loving arms, 
Oh! mother mine! I'll know I'm in Caroline; 
I've read a lot about Heaven, but give me Dixie all the time; 
for I've found that I'm bound, bound all around, with the Mason Dixon Line.
"
"Hello Central, Give Me No Man's Land (World War I Song) (1918)",['Al Jolson'],"When the gray shadows creep
And the world is asleep
In the still of the night
Baby climbs down a flight
First she looks all around
Without making a sound
Then baby toddles up to the telephone
And whispers in a baby tone

""Hello, Central, give me No Man's Land
My Daddy's there, my Mama told me;
She tip-toed off to bed
After my prayers were said;
Don't ring when you get the number
Or you'll disturb Mama's slumber

I'm afraid to stand here at the 'phone
'Cause I'm alone
So won't you hurry;
I want to know why Mama starts to weep
When I say, 'Now I lay me down to sleep'
Hello, Central, give me No Man's Land""

""Hello, Central, give me No Man's Land
My Daddy's there, my Mama told me;
She tip-toed off to bed
After my prayers were said;
Don't ring when you get the number
Or you'll disturb Mama's slumber

I'm afraid to stand here at the 'phone
'Cause I'm alone
So won't you hurry;
I want to know why Mama starts to weep
When I say, 'Now I lay me down to sleep'
Hello, Central, give me No Man's Land"""
Over There (Par l√†-bas),"['George M. Cohan', 'Enrico Caruso', 'Josef Pasternack']","Johnnie, get your gun,
Get your gun, get your gun,
Take it on the run,
On the run, on the run.
Hear them calling, you and me,
Every son of liberty.
Hurry right away,
No delay, go today,
Make your daddy glad
To have had such a lad.
Tell your sweetheart not to pine,
To be proud her boy's in line. 

Over there, over there,
Send the word, send the word over there -
That the Yanks are coming,
The Yanks are coming,
The drums rum-tumming
Everywhere.
So prepare, say a prayer,
Send the word, send the word to beware.
We'll be over, we're coming over,
And we won't come back till it's over
Over there.

Johnnie, get your gun,
Get your gun, get your gun,
Johnnie show the Hun
Who's a son of a gun.
Hoist the flag and let her fly,
Yankee Doodle do or die.
Pack your little kit,
Show your grit, do your bit.
Yankee to the ranks,
From the towns and the tanks.
Make your mother proud of you,
And the old Red, White and Blue. 

Over there, over there,
Send the word, send the word over there -
That the Yanks are coming,
The Yanks are coming,
The drums rum-tumming
Everywhere.
So prepare, say a prayer,
Send the word, send the word to beware.
We'll be over, we're coming over,
And we won't come back till it's over
Over there."
Tiger Rag,"['The Original Dixieland Five', 'Nick LaRocca']","Hold that tiger
Hold that tiger
Hold that tiger
Hold that tiger
Hold that tiger
Hold that tiger
Hold that tiger

Where's that tiger?
Where's that tiger?
Where's that tiger?
Where's that tiger?
Where's that tiger?
Where's that tiger?
Where's that tiger?"
Say a Prayer for Our Boys Over There (with Henry Burr) [Recorded 1918],['The Peerless Quartet'],"Say a prayer for the boys over there
When they play the Star Spangled Banner
Picture them by the dawn's early light
And ask the Lord to watch over them each night.

Lift your eyes as you silently rise
When they play the Star Spangled Banner
As the song of freedom fills the air
Say a prayer for the boys over there.

All of us are working hand in hand
We're working to preserve this wonderous land
But there is something more we all can do
That will help to bring our loved ones safely through.

Say a prayer for the boys over there
When they play the Star Spangled Banner
Picture them by the dawn's early light
And ask the Lord to watch over them each night.

Lift your eyes as you silently rise
When they play the Star Spangled Banner
As the song of freedom fills the air
Say a prayer for the boys over there."
I'm Sorry I Made You Cry,['Connie Francis'],"I'm sorry dear, so sorry dear
I'm sorry I made you cry
Won't you forget, won't you forgive
Don't let us say goodbye
One little word, one little smile
One little kiss won't you try
It breaks my heart to hear you sigh
I'm sorry I made you cry

One little word, one little smile
One little kiss won't you try
It breaks my heart to hear you sigh
I'm sorry I made you cry"
Smiles,"[""Joseph C. Smith's Orchestra""]","Dearie, now I know just what makes me love you so
Just what holds me and enfolds me in its golden glow
Dearie, now I see ?????? smiles so bright and free
For life's sadness turns to gladness when you smile on me

There are smiles that make us happy
There are smiles that make us blue
There are smiles that steal away the teardrops
As the sunbeams steal away the dew

There are smiles that have a tender meaning
That the eyes of love alone may see
And the smiles that fill my life with sunshine
Are the smiles that you give to me

Dearie, when you smile, ev'rything in life's worthwhile
Love grows fonder as we wander down each magic mile
Dearie, melodies seem to float upon the breeze
Doves are cooing while they're wooing in the leafy trees

(Instrumental Break)

There are smiles that have a tender meaning
That the eyes of love alone may see
And the smiles that fill my life with sunshine
Are the smiles that you give to me
You give to me"
The Battle Hymn Of The Republic,"[""United States Army Field Band and Soldiers' Chorus""]","Mine eyes have seen the glory of the coming of the Lord
He is trampling out the vintage where the grapes of wrath are stored
He hath loosed the fateful lightning of His terrible swift sword
His truth is marching on, His truth is marching
Glory, glory, Hallelujah! Glory, glory, Hallelujah!
Glory, glory, Hallelujah! His truth is marching on
I have seen Him in the watch fires of a hundred circling camps
They have builded Him an altar in the evening dews and damps
I can read His righteous sentence by the dim and flaring lamps
His day is marching on
Hallelujah, Hallelujah!
In the beauty of the lilies, Christ was born across the sea
With a glory in His bosom that transfigures you and me
As He died to make men holy, let us live to make men free
While God is marching on
Glory, glory, Hallelujah! Glory, glory, Hallelujah!
Glory, glory, Hallelujah! His truth is marching on!
His truth is marching on! And on and on and on and on and on"
The Darktown Strutters' Ball,['Alberta Hunter'],"I'll be down to get you in a taxi, honey
Better be ready about half past eight
Now honey, don't be late
I want to be there when the band starts playing
Remember when we get there, honey
The two-steps, I'm goin' to have 'em all
Goin' to dance out both my shoes
When they play the ""Jelly Roll Blues""
Tomorrow night at the Darktown Strutters' Ball...[repeat]"
After You've Gone,"['Bing Crosby', 'Turner Layton', 'Henry Creamer']","After you've gone and left me crying
After you've gone, there's no denying
You'll feel blue; you're gonna be sad
You've missed the dearest pal that (slickest partner) you ever had

There'll come a time, don't you forget it
(Yeah) there'll come a time when you're gonna regret it
Some day when you get lonely
Your heart will break like mine (and) you'll want me only

After you've gone (split) after you've gone away (flown the coop)

After we paid our dues together
You should have stayed through all that nasty weather
Someday while you're feeling badly
You'll need the only one that loves you so madly

But I'll be gone; yes, I'll be gone to stay
Yeah, after I've gone after I've gone away"
Somewhere In France Is the Lily (Recorded 1918),['Charles Hart'],"One day as morning shed its glow
Across the eastern sky,
A boy and girl in accents low,
In a garden said ""Goodbye!""
She said, ""Remember as you stray,
When each must do his share,
The flowers blooming here today
Are emblems over there!""
 
Chorus:
Somewhere in France is the Lily,
Close by the English Rose;
A Thistle so keen, and a Shamrock green,
And each loyal flow'r that grows.
Somewhere in France is a sweetheart,
Facing the battle's chance,
For the flow'r of our youth fights for freedom and truth
Somewhere in France.
Each morning in that garden fair,
Where sweetest perfumes dwell,
The lassie whispers low a pray'r
For the flowr's she loves so well.
And over there as night draws near,
Amid the shot and flame,
Unto the flag he holds so dear,
A soldier breathes her name."
Oui Oui Marie (Recorded 1918),['Arthur Fields'],"Poor Johnny's heart went pitty pat, Somewhere in sunny
France He met a girl by chance with ze naughty naughty
Glance, She looked just like a kitty kitty cat, She loved
To dance and play, Tho' he learned no French when he left
The trench, He knew well enough to say:
Wee Wee Marie, will you do zis for me Wee Wee Marie,
Then I'll do zat for you, I love your eyes they make me feel
So spoony, You'll drive me loony, you're teasing me, Why
Can't we parleyvous like other sweethearts do, I want a
Kiss or two from Ma Cherie, Wee Wee Marie, if you'll
Do zis for me Then I'll do zat for you,
Wee Wee Marie.They walked along the boule boulevard, He whispered
""You for me, Some day in gay Paree I will make you
Marry me"", Just then a bunch of bully bully boys,
Threw kisses on the sly, Marie got wise when they rolled
Their eyes, They sang as they passed her by."
"Carolina, I'm Coming Back to You (Victor 18497) [Recorded 1918]","['Henry Burr', 'The Peerless Quartet']","Home is where my heart is still beatin'
I don't know when I'll see her again
I hate to see her cry when I'm leavin'
Now I'm a thousand miles away again
And she feels like Carolina, looks like California
Shining like those New York lights on Broadway
When she looks back I'm behind her
I'll always be there for her
She makes me feel like home's not so far away
She feels like Carolina
It's hard to understand the way I'm living
And I know you think I'm never coming home
But I miss your pretty smile, and I'm coming back in a little while
But I'm a thousand miles away again
And she feels like Carolina, looks like California
Shining like those New York lights on Broadway
When she looks back I'm behind her
I'll always be there for her
She makes me feel like home's not so far away
No matter how far I go, you know I can't stop thinking about her
And there's nothing like the way I feel, the way I feel when I'm beside her
Oh, oh, oh, oh
Oh, oh, oh, oh
She feels like Carolina, looks like California
Shiny like those New York lights on Broadway
When she looks back I'm behind her
I'll always be there for her
She makes me feel like home's not so far away
Carolina, California
Like home's not so far away
She feels like Carolina, looks like California
She makes me feel like home's not so far away
She makes me feel like home's not so far away"
"I May Be Gone For A Long, Long Time",['The Peerless Quartet'],"Goodbye dear,
I'm leaving you today,
Don't cry dear,
Just dry those tears away.
Duty calls and I must obey,
But I'll always hope and pray.
While I'm sailing far across the sea,
Will you always think of me?

I may be gone for a long long time,
Long long time,
Long long time,
But when I go
You will know
That I'll always pine
For the day when you'll be mine.
Be true to me for a long long time,
Rain or shine,
Sweetheart mine,
And I'll be just as true to you
As to the red white and blue,
Though I'm gone for a long long time.

One day dear,
When I come back to you,
We will build
A little home for two.
Then we'll settle down, dear, for life,
Far away from care and strife.
Cheer up dear, and when I'm far away,
Don't forget to write each day.

I may be gone for a long long time,
Long long time,
Long long time.
But when I go
You will know
That I'll always pine
For the day when you'll be mine.
Be true to me for a long long time,
Rain or shine,
Sweetheart mine,
And I'll be just as true to you
As to the red white and blue,
Though I'm gone for a long long time.

I'm gone for a long long time,
Rain or shine,
Sweetheart mine,
And I'll be just as true to you
As to the red white and blue,
Though I'm gone for a long long time."
'N Everything (1917),['Al Jolson'],"I'm as nutty as a squirrel
Cause I got myself a girl
Who's got me dreaming
And scheming all the day long
I want to say she's got um

I could never get a thrill
Out of any girl until
I met this girl for whom I sigh
And it is why

She's got a pair of eyes that speak of love and everything
She's got a - I just can't explain it
She's just my size and everything

She's got some pretty curving lines
A little nose that never sighs
My little cutie
Oh she's a beauty
And for her my poor heart pines

And when we walk along the streets of Marseilles
Pretty baby and everything
And for her hand I've got a wedding band and everything
And if she'll be my, my little wife
We're gonna lead that simple life
And we'll raise a lot of cows and chickens and everything

She's gotta, she's gotta pair of eyes that speak of love and everything

She's gotta - I can't explain it
Oh she's just my size and everything
She's got the curving lines
A little nose that never dies
My little cutie, she is a beauty
And my poor heart pines

And when we walk along the street
She shakes her head and everything
And look, look at her little finger
She's got a ring I've given her and everything

And if she'll be my, my little wife
We're gonna lead the simple life
And we'll raise a lot of cows and chickens and stuff
And everything"
In the Land O' Yamo Yamo,['Van & Schenck'],"There's a place that you never can trace in Geography, 
come on with me, come on and see, 
if you haven't been there I'm sure you'll declare 
that you ought to be it's so much like old Napoli.

Wine and song are flowing along like a melody, 
in Napoli, come on with me, 
the girls are fair and everything there is in harmony
It's the one place on Earth to be.

In the land o' Yamo, Yamo, Funiculi, Funiculi, Funicula
Lights are blinking, while you're drinking, 
it's the place where the goodfellows are, 
Good bye to all your sorrows, you never hear them talk about war, 
in the land of Yamo, Yamo, Funiculi, Funiculi, Funicula."
Whispering Hope,['Olive Kline'],"Soft as the voice of an angel
Breathing a lesson unheard
Hope with a gentle persuasion
Whispers her comforting word
Wait 'til the darkness is over
Wait 'til the tempest is done
Hope for the sunshine tomorrow
After the darkness is gone
Whispering hope (whispering hope, whispering hope)
Oh, how welcome Thy voice (welcome Thy voice, oh, how welcome Thy voice)
Making my heart (making my heart, making my heart)
In its sorrow rejoice (in its sorrow rejoice)
If in the dusk of the twilight
Dim be the region afar
Will not the deepening darkness
Brighten the glimmering star
Then when the night is upon us (ooh)
Why should the heart sink away?
When the dark midnight is over
Watch for the breaking of day
Whispering hope (whispering hope, whispering hope)
Oh, how welcome Thy voice (welcome Thy voice, oh, how welcome Thy voice)
Making my heart (making my heart, making my heart)
In its sorrow rejoice (in its sorrow rejoice)"
Are You Lonesome Tonight?,['Henry Burr'],"Are you lonesome tonight,
Do you miss me tonight?
Are you sorry we drifted apart?
Does your memory stray to a brighter sunny day
When I kissed you and called you sweetheart?
Do the chairs in your parlor seem empty and bare?
Do you gaze at your doorstep and picture me there?
Is your heart filled with pain, shall I come back again?
Tell me dear, are you lonesome tonight?
I wonder if you're lonesome tonight
You know someone said that the world's a stage
And each must play a part.
Fate had me playing in love you as my sweet heart.
Act one was when we met, I loved you at first glance
You read your line so cleverly and never missed a cue
Then came act two, you seemed to change and you acted strange
And why I'll never know.
Honey, you lied when you said you loved me
And I had no cause to doubt you.
But I'd rather go on hearing your lies
Than go on living without you.
Now the stage is bare and I'm standing there
With emptiness all around
And if you won't come back to me
Then make them bring the curtain down.
Is your heart filled with pain, shall I come back again?
Tell me dear, are you lonesome tonight?"
It's A Long Way To Tipperary,['John McCormack'],"Up to mighty London came
An Irish man one day
All the streets were paved with gold
So everyone was gay!
Singing songs of Piccadilly
Strand, and Leicester Square
'Til Paddy got excited and
He shouted to them there:
It's a long way to Tipperary
It's a long way to go.
It's a long way to Tipperary
To the sweetest girl I know!
Goodbye Piccadilly
Farewell Leicester Square!
It's a long long way to Tipperary
But my heart's right there.
It's a long way to Tipperary
It's a long way to go.
It's a long way to Tipperary
To the sweetest girl I know!
Goodbye Piccadilly
Farewell Leicester Square!
It's a long long way to Tipperary
But my heart's right there.
Paddy wrote a letter
To his Irish Molly O'
Saying, ""Should you not receive it
Write and let me know!
If I make mistakes in ""spelling""
Molly dear"", said he
""Remember it's the pen, that's bad
Don't lay the blame on me"".
It's a long way to Tipperary
It's a long way to go.
It's a long way to Tipperary
To the sweetest girl I know!
Goodbye Piccadilly
Farewell Leicester Square
It's a long long way to Tipperary
But my heart's right there.
It's a long way to Tipperary
It's a long way to go.
It's a long way to Tipperary
To the sweetest girl I know!
Goodbye Piccadilly
Farewell Leicester Square
It's a long long way to Tipperary
But my heart's right there."
